"station_id","station_english_name","station_nepali_name","station_latitude","station_longitude"
"1002","Maitighar  ","माइतीघर ","27.6938263","85.3213987"
"1003","Hanumansthan","हनुमानस्थान","27.693499775963488","85.32754428684711"
"1004","Singhadurbar","सिंहदरबार","27.698462422640432","85.32155927270651"
"1005","Kamaladi Bus Stop","कमलादी","27.7079801","85.3177696"
"1006","Shankardev Bus Route Point","शंकरदेव","27.703054681034537","85.32247591763736"
"1007","Dillibazzar Bus Stop","डिल्लीबजार","27.705368","85.3266746"
"1008","Tilingatar Bus Route Point","तिलिंगाटार","27.7432615","85.3298986"
"1009","Basundhara Bus Stop","बसुन्धरा","27.7422265","85.3326666"
"1010","Bhatbhateni  Narayangopal Chowk","भाटभटेनी नारायणगोपाल चोक","27.73927182893425","85.33860135823488"
"1012","Narayangopal Chok Route Point","नारायणगोपाल चोक","27.74003594321974","85.3370963037014"
"1013","Chappal Karkhana Bus Route Point","चप्पल कारखाना चोक","27.734747865839978","85.34247178584337"
"1014","Boudha Bus Route Point","बौद्ध","27.7207074","85.3617525"
"1015","Jorpati Bouddha","जोरपाटी बौद्ध","27.7218091","85.3727818"
"1016","Narayantar Bouddha","नारायणटार बौद्ध","27.72159154731513","85.3798346221447"
"1019","Koteshwor Bus Stop B","कोटेश्वर","27.678413631154278","85.34901302307844"
"1021","Minbhawan Bus Route Point","मिनभवन","27.687756693617544","85.33845718950033"
"1022","New Baneshwor Minbhawan","नया बानेश्वर मिनभवन","27.688336210900587","85.33559560775757"
"1023","Buddhanagar Bus stop","बुद्धनगर","27.68961666005669","85.33000152558088"
"1024","Balkumari Bus Route Point","बालकुमारी","27.671385841328252","85.34020163118839"
"1025","Bhotebahal Bus Route Point","भोटेबहल","27.695821267052825","85.30832324177027"
"1026","Kalimati Bus Route Point","कालिमाटी","27.6983909","85.299426"
"1027","Teku Bus Route Point","टेकु","27.696277247225094","85.3069844841957"
"1028","Kuleshwor Bus Stop","कुलेश्वर","27.6918124","85.2987421"
"1029","Balkhu Bus Stop","बल्खु","27.684840356836112","85.29815465211867"
"1030","Soltimode Bus Route Point","सोल्टीमोड","27.696645354828682","85.29365424066783"
"1031","Jaulakhel Chok Bus Stand","जावलाखेल चोक","27.6728345","85.3136069"
"1033","Hariharbhawan Bus Stand","हरिहरभवन","27.6810413","85.3174478"
"1035","Krishna Galli ","कृष्ण गल्लि","27.6798703","85.3190196"
"1039","Patan Hospital Bus Route Point","पाटन अस्पताल","27.668300407052254","85.32169438898563"
"1040","Ekantakuna Bus Route Point","एकान्तकुना चक्रपथ","27.6666726","85.3083336"
"1041","Nakhhu Dobato Bus Route Point","नक्खु दोबाटो","27.6688676","85.3062415"
"1042","Sallaghari Tinkune Bus Route Point","सल्लाघारी तिनकुने","27.671701773478627","85.40843937546015"
"1043","Sallaghari Suryabinayak","सल्लाघारी सुर्यविनायक","27.66998165439303","85.41079502552749"
"1044","Chundevi Bus Route Point","चुनदेवी","27.66697754236578","85.41713777929544"
"1045","Surya Vinayak Bus Route Point","सुर्यविनायक","27.665731273375926","85.42441997677088"
"1046","Jagati Bus Route Point","जगाती","27.66644720423729","85.43757554143667"
"1047","Nalinchok Bus Route Point","नलिन्चोक","27.654075580073293","85.45699506998061"
"1048","Palase Bus Route Point","पलासे","27.643788732703086","85.46536222100258"
"1049","Nikosera Bus Route Point","निकोसेरा","27.679153825380244","85.4023839533329"
"1050","Thimi Bus Route Point","ठिमी","27.673330116051385","85.38593899458647"
"1051","Jamal","जमल","27.70872304841058","85.31467538326979"
"1053","Purano Buspark Bhrikutimandap","पुरानो बसपार्क भृकुटीमण्डप","27.701870567738805","85.31659685075283"
"1054","Khani Bibhag","खानी बिभाग","27.71841225870592","85.31741324812172"
"1055","Hotel Gangzhong Lazimpat","ज्ञानग्जोङ","27.72282619751261","85.32117772847414"
"1056","Panipokhari Lazimpat","पानि पोखरी लाजिम्पाट","27.728159666342798","85.32422102987766"
"1057","Ratnapark Bus Route Point","रत्नपार्क","27.7067251","85.3153718"
"1058","Lainchour Bus Route Point","लैनचौर","27.7172063","85.3150405"
"1059","Gaushala Pinglasthan","गौशाला पिंग्लास्थान","27.7074909","85.3439856"
"1060","Mitrapark Bus Route Point","मित्रपार्क","27.713268274978397","85.34546781331301"
"1061","Chabahil Gopikrishna","चाबहिल गोपीकृष्ण","27.718373377735634","85.34689575433731"
"1062","Pinglasthan Bus Route Point","पिंग्लास्थान","27.705773729366715","85.34729037433863"
"1064","Maitidevi Ratopul","मैतीदेवी रातोपुल","27.7081986","85.3334016"
"1065","Maijubahal Bus Route Point","मैजुबहाल चोक","27.7176468","85.3475945"
"1067","Kalanki Bus Route Point","कलंकी ","27.6933988","85.2816591"
"1068","Kalanki Malpot Bus Route Point","कलंकी मालपोत","27.6916984","85.2825147"
"1069","Thapathali Campus","थापाथली क्याम्पस","27.6939878","85.319277"
"1072","Gwarko Route Point","ग्वार्खो","27.666631308470492","85.3321261703968"
"1073","Saatdobato Bus Route Point","सातदोबाटो","27.65876770286948","85.3247058391571"
"1074","Mahalaxmisthan Bus Route Point","महालक्ष्मीस्थान थसिखेल","27.6613821","85.3181854"
"1075","Samakhushi Bus Route Point","सामाखुसी","27.735126823580458","85.31819745898247"
"1077","Balaju Chowk","बालाजु चोक","27.72720553146613","85.30480753630398"
"1078","Naya Bus Park Route Point","नया बसपार्क","27.735157982928836","85.30817840248346"
"1079","Siddhartha Banasthali Chok","सिद्धार्थ बनस्थली चोक","27.724865417257252","85.29783044010401"
"1080","Dhungedhara Banasthali","ढुंगेधारा बनस्थली","27.72339543777434","85.29454976320268"
"1081","Machha Pokhari Bus Route Point","माछा पोखरी","27.735268079221733","85.30581302940847"
"1082","BalMandir Bus Route Point","बालमन्दिर","27.7149565","85.3296626"
"1083","Naag Pokhari Bus Stop","नाग पोखरी","27.71335583544097","85.32360948622227"
"1084","Chhate Ganesh Bus Route Point","छाते गणेश बस रुट पोइन्ट","27.7170769417201","85.33037200570105"
"1085","Bhatbhateni Tangal","भाटभटेनी टंगाल","27.71917859683293","85.33106032758951"
"1086","Naxal Bus Stop","नक्साल टंगाल","27.7126438","85.3286809"
"1088","Saraswati Campus Route Point","सरस्वति क्याम्पस","27.718234177812313","85.31077578663826"
"1090","Balaju Pul Bus Route Point","बालाजु पूल","27.7253563","85.3054154"
"1091","Ascal Bus Route Point","अस्कल","27.7177964","85.3132099"
"1092","SukeDhara Bus Route Point","सुकेधारा ","27.7280748","85.345788"
"1093","Dhumbarahi Bus Stop","धुम्बाराही","27.7317357","85.3443718"
"1094","Gopikrishna Pul","गोपीकृष्ण पूल","27.721795740428096","85.34562673419713"
"1095","Airport Goldengate Bus Route Point","एयरपोर्ट गोल्डेन गेट","27.7008904","85.3534698"
"1096","Sinamangal Bus Route Point","सिनामंगल ","27.6952988","85.3550202"
"1097","Tilganga Bus Route Point","तिलगंगा","27.7061184","85.3496182"
"1098","3 No Cargo Gate","३ नं कार्गो गेट","27.6914134","85.3528905"
"1099","Thulo Bharyang Bus Route Point","ठुलो भर्यांग","27.7196912","85.286876"
"1100","Halchok Bus Route Point","हलचोक","27.7173215","85.2837163"
"1101","Sitapaila Bus Route Point","सिता पाइला","27.7076856","85.2824771"
"1102","Sano Bharyang Bus Route Point","सानो भर्यांग","27.7207715","85.2891934"
"1103","Bafal Bus Route Point","बाफल","27.7032212","85.2820051"
"1104","Kaushaltar Bus Route Point","कौसलटार","27.674521071155723","85.36420773714781"
"1105","Lokanthali Bus Route Point","लोकन्थली","27.6748084899393","85.3597344830632"
"1106","Gatthaghar Bus Route Point","गट्ठाघर","27.673964343571797","85.37325214594603"
"1107","Chardobato Bhaktapur","चारदोबाटो भक्तपुर","27.673525194852107","85.37984400987624"
"1108","Shrijananagar Bus Route Point","श्रीजना नगर","27.673004983942814","85.40393527597189"
"1109","Tribhuban Park Bus Route Point","त्रिभुवन पार्क","27.6903684","85.2216768"
"1110","Satangul Bus Route Point","सतुंगल","27.6868936","85.2512509"
"1111","Gurjudhara Bus Route Point","गुर्जुधारा","27.68777361604083","85.24216018617155"
"1112","Thankot Check Post","थानकोट चेक पोस्ट","27.6889908","85.2271217"
"1113","Nagdhunga Bus Route Point","नागढुंगा","27.6994928","85.2088505"
"1114","Sanepa Balakhu","सानेपा बल्खु","27.684324653222582","85.30166834592819"
"1115","Dhobighat Bus Route Point","धोविघाट","27.6747628","85.302015"
"1116","Nayabato Bus Route Point","नयाबाटो","27.6783501","85.302068"
"1117","Kirtipur Road","किर्तिपुर रोड","27.6761363","85.2937907"
"1118","TU Gate","टि यू गेट","27.67888838927917","85.29707238078117"
"1119","Panga Dobato Bus Route Point","पाँगा दोबाटो","27.674749996715082","85.28037797659636"
"1120","Kirtipur Nagarpalika Bus Route Point","किर्तिपुर नगरपालिका","27.682223811262475","85.2725388854742"
"1121","Chobhar Jala Binayak Bus Route Point","चोभार जलविनायक","27.658884112470037","85.29143270105124"
"1122","Chapali Bus Route Point","चपली","27.7676526","85.3557497"
"1123","DeubaChok Bus Stop","देउवा चोक","27.7748294","85.361082"
"1124","Golfutar Bus Route Point","गोल्फुटार","27.751038","85.3457665"
"1125","Hattigauda Budanilkantha","हात्तिगौडा बुढानिलकण्ठ","27.7561271","85.3489637"
"1127","Tyanglaphat Bus Route Point","त्यन्गलाफाट","27.6789748","85.2787891"
"1128","Satikhel Bus Route Point","सतीखेल","27.619975025813346","85.2645831182599"
"1129","Khahare Taudaha","खहरे टौदह","27.646682108410193","85.27740642428398"
"1130","Chalnakhel Bus Route Point","चाल्नाखेल","27.6378868","85.2795482"
"1131","Hattiban Bus Route Point","हात्तिबन","27.6479945","85.3356922"
"1132","Farping Bazaar Bus Route Point","फर्पिंग बजार","27.612998738578927","85.26469342410564"
"1134","Nakhhu Pul Bus Route Point","नक्खु पूल","27.6638623","85.3063139"
"1135","Mangal Bazaar Bus Route Point","मंगलबजार","27.672597","85.3249311"
"1136","Gaabahal Bus Route Point","गाबहाल","27.67428","85.320995"
"1138","Byasi Bus Route Point","ब्यासी","27.6754047","85.4299289"
"1139","Saraswatinagar Bus Route Point","सरस्वतीनगर","27.6848962","85.3569031"
"1140","Pepsicola Bus Route Point","पेप्सीकोला","27.68913601095144","85.36030814051628"
"1141","Sai Ram Chowk Bus Route Point","साइराम चोक","27.6898934","85.3630722"
"1142","Purano Bipul Chowk Bus Route Point","पुरानो बिपुल चोक","27.7163195","85.3670633"
"1143","Khahare Kadaghari","खहरे काँडाघारी","27.6966002","85.3662479"
"1144","Kandhaghari Micro Bus Route Point","काडाघारी माइक्रो पार्क","27.695003110354023","85.37089984863997"
"1145","Kaandaaghari Chowk Bus Route Point","काँडाघारी","27.6977592","85.3714299"
"1146","Birendra Chowk Bus Route Point","बिरेन्द्र चोक","27.6987756","85.3737688"
"1149","Mulpani Peepalbot Bus Route Point","मुलपानी पिपलबोट","27.70648405473841","85.39431251585484"
"1150","Baba Chowk Mulpani","बाबा चोक मुलपानी","27.7128242","85.3935742"
"1151","Milan Chowk Mulpani","मिलन चोक मुलपानी","27.7156736","85.3982198"
"1152","Chautaaro Mulpani","चौतारो मुलपानी","27.7162435","85.3966749"
"1153","Tiwari Toll Bus Route Point","तिवारी टोल","27.719001110790092","85.39381094276905"
"1154","Thali Bus Route Point","थली","27.7272035","85.405333"
"1155","Danchhi Bus Route Point","डाछि","27.727022716489696","85.4147033393383"
"1157","Kapan Saataley Chowk Bus Route Point","कपन सात तले","27.7269755","85.3504443"
"1158","Narayan Chowk Bus Route Point","नारायण चोक","27.728407472946106","85.3517971560359"
"1159","Pancha Kumari Bus Route Point","पंच कुमारी","27.7291408","85.3534913"
"1160","Milan Chowk Kapan","मिलन चोक कपन","27.7298625","85.3550363"
"1161","Tenzing Chowk Bus Route Point","तेन्जिंग चोक","27.7287989","85.3591776"
"1162","Gairi Gaun Hallchowk","गैरीगाउँ हलचोक","27.722963","85.2771503"
"1163","Chabahil Bus Route Point","चाबहिल","27.71712146244321","85.34657891839744"
"1164","Shanti Goreto Bus Route Point","शान्ति गोरेटो","27.71785991018637","85.34794382750988"
"1165","Annapurna Chok Bus Route Point","अन्नपुर्ण चोक","27.7224953","85.2927741"
"1168","Gangahall Bus Route Point","गंगा हल","27.7323293","85.3053685"
"1169","Satsang Bus Route Point","सत्संग","27.7359901","85.3216186"
"1171","Basundhara Chauki Bus Route Point","बसुन्धरा चौकी","27.7380578","85.3250223"
"1172","Chardobato Bode","चारदोबाटो बोडे","27.689932836356363","85.39043739438057"
"1173","Jayabageshwori Bus Route Point","जयबागेश्वरी","27.710406048002646","85.34419711679219"
"1174","Bode Planning Bus Route Point","बोडे प्लान्निंग","27.691992858392037","85.39409793913364"
"1175","Siddhikali Chowk Bus Route Point","सिद्धिकाली ","27.682454205174547","85.38321688771248"
"1176","Bahakha Bazzar Bus Route Point","बाखाबजार","27.682977","85.386343"
"1177","Basipukhu Toll Bus Route Point","बसीपुखु टोल","27.6814189","85.3848839"
"1178","Nasanani Toll Bus Route Point","नसानानी","27.6810769","85.3845191"
"1179","Nasanani Toll Bus Route Point","नासानानी टोल","27.6810959","85.3847551"
"1180","Chapaa-Cho Toll Bus Route Point","छापा-चो टोल","27.6812812","85.3855544"
"1181","Lachhi Toll Bus Route Point","लाछी","27.6809296","85.3861177"
"1182","Gaarchaa Toll Bus Route Point","गारछा टोल","27.6818179","85.386225"
"1183","Pacho Toll Bus Route Point","पाको टोल","27.681913","85.3880033"
"1185","Panika Bus Route Point","प.नि.का","27.682597","85.3723311"
"1186","Radheradhe Chowk Purano Bato","राधेराधे पुरानो बाटो","27.6800128","85.3983378"
"1187","Hindunagar Chowk Bus Route Point","हिन्दुनगर चोक","27.6794427","85.4011488"
"1188","Dhungedhara Bhaktapur","ढुंगेधारा चोक भक्तपुर","27.67866748894492","85.40467087179422"
"1190","Loktantrik Chowk Bus Route Point Chapagaaun Dobato","लोकतान्त्रिक चोक चापागाउँ दोबाटो","27.650030392850155","85.32106071710587"
"1191","Amarawati Bus Route Point","अमरावती","27.67382568084693","85.34260924905539"
"1192","KhariBot Balkumari Chok","खरीबोट बालकुमारी चोक","27.67025631703383","85.338239595294"
"1194","B&B Bus Route Point","बि एंड बि","27.6643469","85.3301561"
"1195","New Baneshwor Bijulibazar","नया बानेश्वर बिजुलीबजार","27.6886013","85.3347051"
"1196","New Baneshwor Anamnagar","नया बानेश्वर अनामनगर","27.69033184063329","85.33589098602535"
"1197","Thecho Bus Route Point","ठेचो","27.612573","85.31991"
"1198","Bijuli Bazar Hanumanthan","बिजुली बजार हनुमानस्थान","27.692149013543013","85.33019933849573"
"1200","Tasinchok Bus Route Point","तासिन्चोक","27.6075248","85.3363359"
"1201","Swiming Pool Bus Route Point","स्विमिंग पूल ","27.6601207","85.3267068"
"1202","Jwagal Chowk Bus Route Point","ज्वागल चोक","27.6854662","85.3182149"
"1203","Engineering Campus Bus Route Point","इन्जीनियरिंग क्याम्पस","27.6822455","85.3195024"
"1204","Bhanjyang Jharuwarashi","भन्ज्यांग झरुवाराशी","27.61200081659778","85.33836767077446"
"1205","Pulchowk Bus Route Point","पुल्चोक","27.6767824","85.3161764"
"1207","Santaneshwar Mahadev Bus Route Point","संतानेश्वर महादेव ","27.6148736","85.3428698"
"1208","Badegaun Bus Route Point","बाडेगाउँ","27.6178207","85.3527188"
"1209","Medical Chowk Bus Route Point","मेडिकल चोक","27.7194917","85.3028512"
"1210","Taukhel Bus Route Point","टौखेल बसपार्क","27.611521014611977","85.35749249160288"
"1211","Gitangali Chowk Bus Route Point","गितांजलि चोक","27.7193588","85.304997"
"1212","Thaiba Bus Route Point","ठैब","27.6247221","85.3480625"
"1213","Phalphul Chowk Bus Route Point","फलफुल चोक","27.7192353","85.3068531"
"1214","Chapagaun Dobato Bus Route Point","चापागाउँ दोबाटो","27.6579493","85.3225493"
"1215","Taalchhikhel Bus Route Point","तल्छिखेल","27.659092","85.320999"
"1216","BID Gate Bus Route Point","बि.आई.डी गेट","27.7297106","85.303731"
"1217","Pipal Bot Bus Route Point","पिपलबोट","27.6626816","85.3404236"
"1219","Samarpan Chowk Bus Route Point","समर्पण चोक","27.7318663","85.2956951"
"1222","Sanagaun School Chok","सानागाउँ स्कुल चोक","27.6497575","85.358963"
"1223","Kantipur College Bus Route Point","कान्तिपुर कलेज","27.6472485","85.364778"
"1224","Kwo Lachhi Bus Route Point","को लाछी","27.644081875360136","85.37150200456381"
"1225","Lubhu Bus Route Point","लुभू बसपार्क","27.642889103575488","85.37334702908993"
"1226","Pani Tyanki Bus Route Point","पानि टंकी लुभू","27.640472","85.3821051"
"1227","Lamatar Bus Route Point","लामाटार बसपार्क","27.63276249379342","85.39091650396584"
"1228","Dhungin Buspark Bus Route Point","ढुंगीन","27.627973","85.3951943"
"1233","Chapagaun Bus Route Point","चापागाउँ बसपार्क","27.597558599361665","85.32372448593378"
"1235","Magargaun Bus Park Bus Route Point","मगरगाउँ भैंसीपाटि","27.649154","85.3002146"
"1236","Dhaulagiri Chowk Bus Route Point","धौलागिरि चोक","27.7379439","85.3628361"
"1239","Kharibot Kapan","खरीबोट कपन","27.7355034","85.3642631"
"1240","Motitar Bus Route Point","मोतिटार","27.6649741","85.3591079"
"1241","Thapa Chowk Tikathali","थापा चोक टिकाथली","27.6644918","85.3615084"
"1242","Simaltar Chowk Bus","सिमल्टार","27.7323506","85.3741336"
"1244","Aarubari Chowk Bus station","आरुबारी चोक","27.7312585","85.3757751"
"1245","Sundarijal Bus Route Point","सुन्दरीजल","27.7589944","85.4207611"
"1246","BP Chowk Bus Route Point","बि.पी. चोक","27.7505063","85.4143667"
"1247","Bhadrabas Chowk Bus Route Point","भद्रबास चोक","27.738789","85.4181647"
"1249","Bhimeshower Bus Route Point","भिमेश्वर","27.7419274","85.4345745"
"1250","Sanagaun Chowk Indrayini","सानागाउँ  चोक इन्द्रायणी","27.7369088","85.4458237"
"1252","Indrayani Bus Route Point","इन्द्र्यायिनी","27.730048917789833","85.4340098798275"
"1254","Bir Hospital Bus Route Point","बिर अस्पताल","27.7057099","85.3142238"
"1256","Ghattekulo Bus Route Point","घट्टेकुलो","27.69943313589956","85.32858934253456"
"1257","Seto Pool Bus station","सेतो पूल","27.702960581751523","85.33579844981432"
"1258","Maitidevi Chowk Dillibazar","मैतीदेवी डिल्लीबजार","27.70390127408938","85.33261768519877"
"1259","Dillibazar Pipal Bot","डिल्लीबजार पिपलबोट","27.7049785","85.3291368"
"1260","Charkhal Bus Route Point","चारखाल","27.7065553","85.327034"
"1261","Putalisadak Computer Bazar","पुतलीसडक कम्प्युटर बजार","27.7068972","85.3227425"
"1263","Tara Hal Chowk Bus Route Point","तारा हल चोक ","27.697120330547307","85.3505227714777"
"1264","Saraswotikhel Chowk Bus Route Point","सरस्वतिखेल चोक","27.69497401758634","85.39916597306728"
"1265","Mahankal Chowk Bus Route Point","महांकाल चोक","27.699661712383552","85.41732855141163"
"1266","High School Bus Route Point","हाई स्कुल","27.7044086","85.4180789"
"1267","NEC College Bus Route Point","एन.ई.सि कलेज","27.709001472357738","85.41608098894358"
"1268","Nyacho Pauwa Bus Route Point","न्या:च्व पौवा","27.716846324083434","85.43261211365461"
"1269","Ramailo Gaun Bus Route Point","रमाइलो गाउँ","27.7127103","85.4386568"
"1270","Indra Chowk Bus Route Point","इन्द्र चोक","27.7103547","85.4391503"
"1271","Ghumti Ghar Bus Route Point","घुम्ति घर","27.7055864","85.4396868"
"1272","Pikhel Bus Route Point","पिखेल","27.7022808","85.4399443"
"1273","Pakune Pati Centre Bus Route Point","पाकुने पाटि","27.6970562","85.4407167"
"1274","Bansbari Kharipati","बाँसबारी खरिपाटी","27.6887153","85.4574859"
"1275","Ghumaune Bus station","घुमाउने","27.6949188","85.4607475"
"1276","Subidhanagar Nagarkot","सुविधानगर नगरकोट","27.6955553","85.46314"
"1277","Krishna Mandir Kushaltar","कृष्ण मन्दिर कुशलटार","27.6966857","85.4655218"
"1278","Bhadrakali Nagarkot","भद्रकाली नगरकोट","27.6978352","85.4667234"
"1279","Kharipati Bus Route Point","खरीपाटि","27.7024138","85.4702961"
"1280","Muhan Pokhari Bus Route Point","मुहान पोखरी","27.7045131","85.4741371"
"1281","Mahakali Bus Route Point","महाकाली","27.675894","85.431726"
"1282","Redcross Chowk Bus Route Point","रेड्क्रस चोक","27.6695802","85.3658295"
"1283","Changu Narayan Bus Route Point","चाँगुनारायण बसपार्क","27.6763548","85.4327506"
"1284","Mahalaxmi Changunarayan","महालक्ष्मी चाँगुनारायण","27.6761458","85.4336196"
"1286","Dhansar Bus Route Point","धनसार","27.6537489","85.3775239"
"1287","Kamal Vinayak Bus Route Point","कमल विनायक","27.6764023","85.4371816"
"1288","Chardobato Biruwa","चारदोबाटो बिरुवा","27.6503087","85.3829741"
"1289","Tarkhagal Bus Route Point","तर्खागाल ","27.6476381","85.395999"
"1290","Nagarkot Kamalbinayak","नगरकोट कमलविनायक","27.6775615","85.4377556"
"1291","Kitta Chaur Bus Route Point","कित्ता चौर","27.6092646","85.3732216"
"1292","Godawari Bus Route Point","गोदावरी","27.594518","85.3780925"
"1293","Bungmati Bus Route Point","बुंगमति","27.6284946","85.303684"
"1294","Khari Bot Balkumari","खरीबोट बालकुमारी","27.6675088","85.3490496"
"1295","Bhagawati Mandir Balkumari","भगवती मन्दिर बालकुमारी","27.6673187","85.3532124"
"1296","Jhikucha Bus Route Point","झिकू:च","27.6659504","85.3551865"
"1297","Manamaiju Futung","मनमैजु फुटुंग","27.7518735","85.3122336"
"1300","Tikathali Thapa Chowk","टिकाथली थापा चोक","27.664354","85.3628469"
"1301","By Pass Bus Route Point","बाइपास","27.7365741","85.3018185"
"1303","Force Park Bus Route Point","फोर्स् पार्क","27.66123365933634","85.36967273801565"
"1304","Nepaltar Bus Route Point","नेपालटार","27.7411772","85.3033662"
"1305","Seshmati Pul Bus Route Point","सेसमति पूल","27.744041298114766","85.3003416582942"
"1306","Shantitol Bus Route Point","शान्ति टोल","27.748764","85.3015476"
